author ,title ,summary ,images ,source ,date ,link
Blank ,Beat the post holiday blues ,There's no need to dread going back to work if you follow these great tips to get back to business. ,Blank ,TheAge RSS News Headlines ,Tue 17 Feb 2015 07:28:04 -0000 ,http://theage.com.au/small-business/growing/beat-the-post-holiday-blues-20150127-12z873.html
Blank ,Six top business lessons ,What's the best advice Australia's most successful entrepreneurs have ever followed?   ,Blank ,TheAge RSS News Headlines ,Sun 26 Apr 2015 20:36:23 -0000 ,http://theage.com.au/small-business/trends/six-top-business-lessons-20150413-1mjrpd.html
Blank ,What price exotic beer? ,A local craft brew portal wants to know which overseas ales local drinkers admire. ,Blank ,TheAge RSS News Headlines ,Tue 28 Apr 2015 09:26:48 -0000 ,http://theage.com.au/small-business/growing/what-price-exotic-beer-20150414-1mkvp2.html
Blank ,The Aussie email marketing gurus ,Which local success story has more than 120000 clients in 170 countries?   ,Blank ,TheAge RSS News Headlines ,Tue 07 Jul 2015 19:30:21 -0000 ,http://theage.com.au/small-business/growing/the-aussie-email-marketing-gurus-20150407-1mgcu1.html
Blank ,Cronulla Sharks props Andrew and David Fifita urged to stop loitering at grounds ,The Penrith Referees Association has urged the Fifita brothers to uphold the spirit of their 12-month bans claiming abused officials can't move on while they are loitering outside their grounds. ,Blank ,TheAge RSS News Headlines ,Thu 20 Aug 2015 15:19:30 -0000 ,http://theage.com.au/rugby-league/cronulla-sharks/cronulla-sharks-props-andrew-and-david-fifita-urged-to-stop-loitering-at-grounds-20150820-gj3wot.html
Blank ,To get the remaining $1billion for NRL broadcast deal Dave Smith must fix rugby league ,Rugby league is a better TV product than AFL - but it needs urgent repair ,Blank ,TheAge RSS News Headlines ,Thu 20 Aug 2015 15:16:56 -0000 ,http://theage.com.au/rugby-league/league-news/to-get-the-remaining-1billion-for-the-broadcast-deal-dave-smith-must-fix-rugby-league-20150820-gj3ful.html
Blank ,Religious instruction scrapped from curriculum ,Victorian schools will scrap special religious instruction from class time with the future of the controversial program in doubt under new changes to curriculum. ,Blank ,TheAge RSS News Headlines ,Thu 20 Aug 2015 15:02:17 -0000 ,http://theage.com.au/victoria/religious-instruction-scrapped-from-curriculum-20150820-gj425e.html
Blank ,Man charged with murder over Carlton stabbings ,A 47-year-old man has been charged with murder following a stabbing in Carlton in July. ,Blank ,TheAge RSS News Headlines ,Thu 20 Aug 2015 14:58:54 -0000 ,http://theage.com.au/victoria/man-charged-with-murder-over-carlton-stabbings-20150820-gj47f8.html
Blank ,Bangkok bombing: Two suspects hand themselves in to Thai police ,Two men who were identified by Thai authorities as suspects in the Bangkok bombing handed themselves in to police saying they are tour guides Thai police say.
 ,Blank ,TheAge RSS News Headlines ,Thu 20 Aug 2015 14:56:31 -0000 ,http://theage.com.au/world/bangkok-bombing-two-suspects-hand-themselves-in-to-thai-police-20150820-gj47gf.html
Blank ,Teenager critical after shooting at Vermont South shopping centre on Burwood Highway ,Police are concerned the shooter is still on the loose with a 'shotgun' in suburban Melbourne. ,Blank ,TheAge RSS News Headlines ,Thu 20 Aug 2015 14:51:48 -0000 ,http://theage.com.au/victoria/teenager-critical-after-shooting-at-vermont-south-shopping-centre-on-burwood-highway-20150819-gj3akp.html
Blank ,Iranian woman allegedly raped on Nauru flown to Australia for treatment  ,An Iranian asylum seeker who was allegedly raped on Nauru has been flown to Australia for medical treatment three months after the alleged assault took place according to reports in media. ,Blank ,TheAge RSS News Headlines ,Thu 20 Aug 2015 14:44:35 -0000 ,http://theage.com.au/national/iranian-woman-allegedly-raped-on-nauru-flown-to-australia-for-treatment-20150820-gj47aa.html
Blank ,Penrith Panthers fullback Matt Moylan puts comeback on hold until 2016 ,Penrith fullback Matt Moylan has shelved plans to make a return from a serious ankle injury this year as the Panthers fall out of finals contention. ,Blank ,TheAge RSS News Headlines ,Thu 20 Aug 2015 14:30:48 -0000 ,http://theage.com.au/rugby-league/league-news/penrith-panthers-fullback-matt-moylan-puts-comeback-on-hold-until-2016-20150820-gj3ptp.html
Blank ,Greg Bird stars as New York Yankees defeat Minnesota Twins ,Rookie first baseman Greg Bird hit two two-run home runs while right-hander Nathan Eovaldi took a perfect game into the sixth inning as the New York Yankees beat the Minnesota Twins. ,Blank ,TheAge RSS News Headlines ,Thu 20 Aug 2015 14:17:41 -0000 ,http://theage.com.au/sport/us-sports/greg-bird-stars-as-new-york-yankees-defeat-minnesota-twins-20150820-gj47fi.html
Blank ,New York Giants quarterback Eli Manning denies report he wants richest deal ,In a rare display of annoyance Eli Manning disputed a report that he wants to be the NFL's highest-paid player. Manning who is negotiating a new contract with the New York Giants said that neither he nor his agent had made such a demand. ,Blank ,TheAge RSS News Headlines ,Thu 20 Aug 2015 14:27:20 -0000 ,http://theage.com.au/sport/us-sports/new-york-giants-quarterback-eli-manning-denies-report-he-wants-richest-deal-20150820-gj47ee.html
Blank ,STEM education role models: Vanessa Moss ,Vanessa Moss uses the world's biggest telescopes to explore and understand our universe. ,Blank ,TheAge RSS News Headlines ,Thu 20 Aug 2015 14:06:01 -0000 ,http://theage.com.au/technology/sci-tech/stem-education-role-models-vanessa-moss-20150820-gj3w6k.html
Blank ,Portland Trail Blazers plummet into irrelevance after losing LaMarcus Aldridge ,The Portland Trail Blazers can no longer depend on that feathery but deadly midrange jumper from LaMarcus Aldridge those bow-and-arrow three-point celebrations from marksman Wesley Matthews the defensive versatility of Nicolas Batum or the untamed play and mane of mascot-mocking Robin Lopez.  ,Blank ,TheAge RSS News Headlines ,Thu 20 Aug 2015 14:04:47 -0000 ,http://theage.com.au/sport/us-sports/portland-trail-blazers-plummet-into-irrelevance-after-losing-lamarcus-aldridge-20150820-gj47dm.html
Blank ,STEM education role models: Kat Clark ,Kat Clark is a creative technologist web ninja and flying trapeze instructor. ,Blank ,TheAge RSS News Headlines ,Thu 20 Aug 2015 14:03:46 -0000 ,http://theage.com.au/technology/sci-tech/stem-education-role-models-kat-clark-20150820-gj3qw5.html
Blank ,South Korea fires artillery rounds into North Korea in retaliation for suspected rocket ,South Korea fired artillery rounds towards the source of an incoming North Korean projectile in a western area of the inter-Korea border on Thursday Seoul's defence ministry said. ,Blank ,TheAge RSS News Headlines ,Thu 20 Aug 2015 13:52:09 -0000 ,http://theage.com.au/world/south-korea-fires-artillery-rounds-into-north-korea-in-retaliation-for-suspected-rocket-20150820-gj43xk.html
Blank ,Australian Hearing privatisation would be damaging to deaf children say families ,Australian Hearing Services has been targeted by the Department of Finance since last year for a possible sell-off.  ,Blank ,TheAge RSS News Headlines ,Thu 20 Aug 2015 14:35:56 -0000 ,http://theage.com.au/federal-politics/political-news/australian-hearing-privatisation-would-be-damaging-to-deaf-children-say-families-20150819-gj2n1w.html
Blank ,Is this wise Prime Minister? ,The position of Prime Minister Tony Abbott on climate change is increasingly untenable. ,Blank ,TheAge RSS News Headlines ,Thu 20 Aug 2015 13:35:01 -0000 ,http://theage.com.au/comment/is-this-wise-prime-minister-20150820-gj3jcg.html
Blank ,St George Illawarra warned over discipline after three Dragons placed on report ,Tyson Frizell Euan Aitken and Jake Marketo to learn on Friday if they face judiciary charges  ,Blank ,TheAge RSS News Headlines ,Thu 20 Aug 2015 13:23:52 -0000 ,http://theage.com.au/rugby-league/st-george-illawarra-dragons/st-george-illawarra-warned-over-discipline-after-three-dragons-placed-on-report-20150820-gj46yt.html
Blank ,Damien Mantach: Questions about Liberal Party's handle on financial management ,For a party that prides itself on financial management this is a dreadful look. ,Blank ,TheAge RSS News Headlines ,Thu 20 Aug 2015 13:18:09 -0000 ,http://theage.com.au/victoria/damien-mantach-questions-about-liberal-partys-handle-on-financial-management-20150820-gj3j55.html
Blank ,Wine equalisation tax rebate widely rorted Treasury says ,Wine producers face the prospect of losing their generous tax rebates in the wake of a treasury finding of widespread and systematic rorting of the scheme. ,Blank ,TheAge RSS News Headlines ,Thu 20 Aug 2015 13:14:04 -0000 ,http://theage.com.au/business/wine-equalisation-tax-rebate-widely-rorted-treasury-says-20150820-gj4075.html
Blank ,Budding trainer Gabby Englebrecht has a canny ability to get the most out of social media ,Who's Harry? ,Blank ,TheAge RSS News Headlines ,Thu 20 Aug 2015 13:08:44 -0000 ,http://theage.com.au/sport/horseracing/budding-trainer-gabby-englebrecht-has-a-canny-ability-to-get-the-most-out-of-social-media-20150820-gj3jfh.html
Blank ,Insider trading probe into a2 Milk suitor Dean Foods derails takeover plans ,An inside trading investigation into a2 Milk suitor Dean Foods is believed to have derailed the US dairy giant's takeover of the trans-Tasman milk company. ,Blank ,TheAge RSS News Headlines ,Thu 20 Aug 2015 13:07:34 -0000 ,http://theage.com.au/business/insider-trading-probe-into-a2-milk-suitor-dean-foods-derails-takeover-plans-20150820-gj3tnn.html
Blank ,Tony Abbott accuses Labor of peddling  racist lies on free trade agreement ,The Abbott government has accused the Labor opposition of peddling "racist lies" after a rancorous fortnight of Parliament reached an angry climax on Thursday. ,Blank ,TheAge RSS News Headlines ,Thu 20 Aug 2015 13:01:10 -0000 ,http://theage.com.au/federal-politics/political-news/tony-abbott-accuses-labor-of-peddling--racist-lies-on-free-trade-agreement-20150820-gj3yvo.html
Blank ,Live: Ashes 2015 - England v Australia Fifth Test Day 1 from The Oval ,Follow full live coverage of the fifth and final Ashes Test from The Oval. ,Blank ,TheAge RSS News Headlines ,Thu 20 Aug 2015 10:19:12 -0000 ,http://theage.com.au/sport/cricket/the-ashes/live-ashes-2015--england-v-australia-fifth-test-day-1-from-the-oval-20150819-gj38gh.html
Blank ,Seven killed as two planes collide in Slovakia air show rehearsal  ,Two turbo-prop planes carrying civilian parachutists rehearsing for an air show collided in mid-air in Slovakia on Thursday killing seven people authorities said. ,Blank ,TheAge RSS News Headlines ,Thu 20 Aug 2015 12:56:15 -0000 ,http://theage.com.au/world/seven-killed-as-two-planes-collide-in-slovakia-air-show-rehearsal-20150820-gj470n.html
Blank ,Smoking no longer cool for teenagers but e-cigarettes remain a threat ,It used to be a rite of passage. In the 1980s one in four teenagers smoked cigarettes weekly and many went on to get hooked. ,Blank ,TheAge RSS News Headlines ,Thu 20 Aug 2015 12:37:28 -0000 ,http://theage.com.au/victoria/smoking-no-longer-cool-for-teenagers-but-ecigarettes-remain-a-threat-20150820-gj3v75.html
Blank ,Tatts director Brian Jamieson is having trouble keeping track of his stock  ,Tatts boss Robbie Cooke had the spit and polish out to present the company's full year results in the best light possible. ,Blank ,TheAge RSS News Headlines ,Thu 20 Aug 2015 12:32:18 -0000 ,http://theage.com.au/business/cbd/tatts-director-brian-jamieson-is-having-trouble-keeping-track-of-his-stock-20150819-gj36yf.html
Blank ,Seven Australians suspected of joining 'terrorist groups' stopped at Sydney Airport  ,When they were stopped from flying to the Middle East Border Force officers found about $10000 each in their luggage. ,Blank ,TheAge RSS News Headlines ,Thu 20 Aug 2015 12:32:31 -0000 ,http://theage.com.au/national/seven-australians-stopped-at-sydney-airport-suspected-of-joining-terrorist-groups-20150820-gj46rq.html
Blank ,Kids are tobacco sector's main game ,Seeking to influence children to take up smoking and risk their health is diabolical. ,Blank ,TheAge RSS News Headlines ,Thu 20 Aug 2015 12:19:53 -0000 ,http://theage.com.au/comment/smh-letters/kids-are-tobacco-sectors-main-game-20150820-gj3ij0.html
Blank ,Hugh Greenwood walks out on Perth Wildcats to pursue AFL career ,Perth Wildcats' NBL title hopes have been dealt a blow with guard Hugh Greenwood walking out on the club to have a crack at breaking into the AFL ranks. ,Blank ,TheAge RSS News Headlines ,Thu 20 Aug 2015 12:14:51 -0000 ,http://theage.com.au/sport/basketball/hugh-greenwood-walks-out-on-perth-wildcats-to-pursue-afl-career-20150820-gj46vy.html
Blank ,Ashes 2015: Much-needed restraint from Australia delivers solid start at Oval ,A belated adoption of a safety-first approach to batting allowed Australia to go to lunch on day one at the Oval unscathed for the first time in an overseas Test for two and a half years. ,Blank ,TheAge RSS News Headlines ,Thu 20 Aug 2015 15:17:14 -0000 ,http://theage.com.au/sport/cricket/the-ashes/ashes-2015-muchneeded-restraint-from-australia-delivers-solid-start-at-oval-20150820-gj46ua.html
Blank ,SBS takes Dawn Fraser back to where she came from – Peru ,If mercurial tennis player Nick Kyrgios was to tell Dawn Fraser to go back to where she came from the swimming legend would have to book the first plane back to Peru. ,Blank ,TheAge RSS News Headlines ,Thu 20 Aug 2015 12:12:59 -0000 ,http://theage.com.au/victoria/sbs-takes-dawn-fraser-back-to-where-she-came-from--peru-20150820-gj3kvm.html
Blank ,Catholic teachers could strike in final week of term: union ,Teachers at Queensland's 298 Catholic schools could strike in the final week of term as they push for better working conditions their union has warned. ,Blank ,TheAge RSS News Headlines ,Thu 20 Aug 2015 12:10:55 -0000 ,http://theage.com.au/queensland/catholic-teachers-could-strike-in-final-week-of-term-union-20150820-gj46n9.html
Blank ,Amber Smith missing from Logan Hospital ,There are concerns for the welfare of a teenage girl missing from a hospital south of Brisbane. ,Blank ,TheAge RSS News Headlines ,Thu 20 Aug 2015 12:04:46 -0000 ,http://theage.com.au/queensland/amber-smith-missing-from-logan-hospital-20150820-gj46rf.html
Blank ,Guarding the Shrine a salve for damaged WWI hero ,In 1935 traumatised WWI Victoria Cross recipient George Ingram was one of the first Shrine Guards for whom a ceremony marking 80th anniversary is being held on Friday.
 ,Blank ,TheAge RSS News Headlines ,Thu 20 Aug 2015 12:02:46 -0000 ,http://theage.com.au/victoria/guarding-the-shrine-a-salve-for-damaged-wwi-hero-20150819-gj2o0b.html
Blank ,Australian LSU star Ben Simmons makes all the right moves in Melbourne return ,LSU beat Melbourne United 97-89 at Dandenong Stadium on Thursday night while Ben Simmons turned on a show with his dunks and passes. ,Blank ,TheAge RSS News Headlines ,Thu 20 Aug 2015 13:31:04 -0000 ,http://theage.com.au/sport/basketball/australian-lsu-star-ben-simmons-makes-all-the-right-moves-in-melbourne-return-20150820-gj46hr.html
Blank ,Police Minister Jo-Ann Miller's final estimates answer goes to the dogs ,Labor throws a bone to Police Minister Jo-Ann Miller during harsh budget estimates questioning with final question about dog breeds ticking down the clock.  ,Blank ,TheAge RSS News Headlines ,Thu 20 Aug 2015 11:56:54 -0000 ,http://theage.com.au/queensland/police-minister-joann-millers-final-estimates-answer-goes-to-the-dogs-20150820-gj46sy.html
Blank ,So long and thanks for the sharks: kitesurfers' world-record 1000km journey ,Seven kitesurfers are on track to complete a world record 1000-kilometre expedition on the Great Barrier Reef on Friday afternoon having survived shark attacks blistering sun and exhaustion to reach the tip of Cape York.
 ,Blank ,TheAge RSS News Headlines ,Thu 20 Aug 2015 11:55:19 -0000 ,http://theage.com.au/national/so-long-and-thanks-for-the-sharks-kitesurfers-worldrecord-1000km-journey-20150820-gj3nno.html
Blank ,St George Illawarra Dragons still in finals hunt after beating Penrith Panthers ,St George Illawarra five-eighth Gareth Widdop inspired his side to a crucial 19-12 win over Penrith but the Dragons finals hopes may yet take a hit after three players were placed on report in an ugly encounter at WIN Stadium on Thursday night. ,Blank ,TheAge RSS News Headlines ,Thu 20 Aug 2015 12:00:05 -0000 ,http://theage.com.au/rugby-league/league-match-report/st-george-illawarra-dragons-still-in-finals-hunt-after-beating-penrith-panthers-20150820-gj45yz.html
Blank ,Maggie Kirkpatrick Prisoner star 'The Freak' found guilty of child sex abuse ,Maggie Kirkpatrick a star of the Australian drama Prisoner has been found guilty of sexually abusing a teenage girl more than 30 years ago. ,Blank ,TheAge RSS News Headlines ,Thu 20 Aug 2015 11:49:06 -0000 ,http://theage.com.au/victoria/maggie-kirkpatrick-prisoner-star-the-freak-found-guilty-of-child-sex-abuse-20150820-gj3rv8.html
Blank ,In the Herald: August 21 1970 ,Earth Day blooms for Australia as new transport hovers into view. ,Blank ,TheAge RSS News Headlines ,Thu 20 Aug 2015 11:47:47 -0000 ,http://theage.com.au/comment/in-the-herald-august-21-1970-20150817-gj0mpt.html
Blank ,Column 8: Duck milk ,Has Nature gone mad we wonder? "I don't wish to make things any more complicated than they already are" writes Norm Clarke of Wyndham. ,Blank ,TheAge RSS News Headlines ,Thu 20 Aug 2015 11:47:23 -0000 ,http://theage.com.au/comment/column-8/column-8-20150820-gj3ma0.html
Blank ,Canberra Weekender: What's on in Canberra August 21-23 ,Your guide to what's going on around the capital this weekend. ,Blank ,TheAge RSS News Headlines ,Thu 20 Aug 2015 11:46:44 -0000 ,http://theage.com.au/act-news/canberra-life/canberra-weekender-whats-on-in-canberra-august-2123-20150817-gj0jvy.html
Blank ,Newman spent $2 million to improve govt image over Great Barrier Reef ,The public's faith in the State and Federal government's ability to protect the Great Barrier Reef was so low the Newman Government was forced to spend nearly $2 million in restoring confidence in its management of the world heritage listed site. ,Blank ,TheAge RSS News Headlines ,Thu 20 Aug 2015 11:37:13 -0000 ,http://theage.com.au/queensland/newman-spent-2-million-to-improve-govt-image-over-great-barrier-reef-20150820-gj46mb.html
Blank ,Manchester City sign Nicolas Otamendi ,Manchester City have moved to bolster their defence by signing Argentina centre back Nicolas Otamendi from Valencia on a five-year contract. ,Blank ,TheAge RSS News Headlines ,Thu 20 Aug 2015 11:36:40 -0000 ,http://theage.com.au/sport/soccer/manchester-city-sign-nicolas-otamendi-20150820-gj45xd.html
Blank ,Cochlear implant lifts sound cloud ,Next week is Hearing Awareness Week and the cochlear implant is being promoted as a potentially life-changing device for those with hearing loss. ,Blank ,TheAge RSS News Headlines ,Thu 20 Aug 2015 11:34:52 -0000 ,http://theage.com.au/act-news/cochlear-implant-lifts-sound-cloud-20150818-gj1m0k.html
Blank ,Snow lovers are all smiles as the season turns around  ,NSW's ski resorts have had a late-winter boost with blue skies cold temperatures and big snow dumps. ,Blank ,TheAge RSS News Headlines ,Thu 20 Aug 2015 11:32:59 -0000 ,http://theage.com.au/act-news/snow-lovers-are-all-smiles-as-the-season-turns-around-20150820-gj3ud5.html
Blank ,Targeting children's data tips Big Tobacco's hand ,It's no surprise a large tobacco group is trying to dig data on children's attitudes to smoking out of health charities: children were always this industry's main game. ,Blank ,TheAge RSS News Headlines ,Thu 20 Aug 2015 11:28:05 -0000 ,http://theage.com.au/comment/targetting-childrens-data-tips-big-tobaccos-hand-20150820-gj3n0p.html
Blank ,Brazen attempt to hide union rorting ,That a major political party is desperate to discredit an investigation which is uncovering wrongdoing is depressing. ,Blank ,TheAge RSS News Headlines ,Thu 20 Aug 2015 11:26:59 -0000 ,http://theage.com.au/comment/brazen-attempt-to-hide-union-rorting-20150820-gj3d8h.html
Blank ,Ashes 2015: Shane Warne lashes Rod Marsh over Australia's selection in series ,Shane Warne has urged retribution for what he argues have been selection blunders by Australia throughout the Ashes culminating the exclusion of Pat Cummins for the final Test. ,Blank ,TheAge RSS News Headlines ,Thu 20 Aug 2015 12:40:25 -0000 ,http://theage.com.au/sport/cricket/the-ashes/ashes-2015-shane-warne-lashes-rod-marsh-over-australias-selection-in-series-20150820-gj46gz.html
Blank ,Dyson Heydon's extreme view of judicial independence on display ,Extremist in his view of judicial independence Dyson Heydon's decision on Friday will resonate widely ,Blank ,TheAge RSS News Headlines ,Thu 20 Aug 2015 11:22:52 -0000 ,http://theage.com.au/comment/dyson-heydons-extreme-view-of-judicial-independence-on-display-20150820-gj3ugh.html
Blank ,The chequered past of  former Victorian Liberal Party director Damian Mantach  ,The Mantach name is well known in Tasmanian Liberal Party circles. Damien Mantach the former Victorian Liberal Party director accused of embezzling $1.5 million followed his father Brian into the party hierarchy. ,Blank ,TheAge RSS News Headlines ,Thu 20 Aug 2015 11:20:33 -0000 ,http://theage.com.au/victoria/the-chequered-past-of--former-victorian-liberal-party-director-damian-mantach-20150820-gj3nzb.html
Blank ,Genuine reform needed to pave the way to lower taxes ,Cutting the company tax rate by five percentage points and a shift to more efficient taxes could boost GDP by about 1 one per cent. ,Blank ,TheAge RSS News Headlines ,Thu 20 Aug 2015 11:19:24 -0000 ,http://theage.com.au/comment/paving-the-way-to-lower-taxes-20150820-gj3jbz.html
Blank ,Abbott is losing the plot in his war on environmentalists ,We will be subjected to the Abbott Government's nonsensical hyperbole as long as it insists on casting environmentalists as a special interest group that threatens the liberal order. ,Blank ,TheAge RSS News Headlines ,Thu 20 Aug 2015 13:49:38 -0000 ,http://theage.com.au/comment/abbott-is-losing-the-plot-in-its-war-on-environmentalists-20150819-gj3a1p.html
Blank ,Canning by-election looms as make or break for Tony Abbott's leadership ,The WA by-election will be a tough one but it presents the PM with an unlikely opportunity. ,Blank ,TheAge RSS News Headlines ,Thu 20 Aug 2015 11:14:11 -0000 ,http://theage.com.au/comment/byelection-looms-as-make-or-break-for-abbotts-leadership-20150820-gj3kuu.html
Blank ,UQ measles outbreak spreads to fifth student ,A fifth case of measles in as many weeks at Brisbane's largest university sparks fear with hundreds of students potentially exposed in a single lecture. ,Blank ,TheAge RSS News Headlines ,Thu 20 Aug 2015 11:08:15 -0000 ,http://theage.com.au/queensland/uq-measles-outbreak-spreads-to-fifth-student-20150820-gj468h.html
Blank ,Euthanasia's slippery slope ,If you were a psychiatrist and a chronically depressed patient told you he wanted to die what would you do? ,Blank ,TheAge RSS News Headlines ,Thu 20 Aug 2015 11:07:39 -0000 ,http://theage.com.au/comment/euthanasias-slippery-slope-20150820-gj3xeo.html
Blank ,Southern Stars win first T20 against Ireland women ,The Australian women's cricket team have claimed a 25-run win over Ireland in the first Twenty20 international of their three-match series in Dublin. ,Blank ,TheAge RSS News Headlines ,Thu 20 Aug 2015 10:57:56 -0000 ,http://theage.com.au/sport/cricket/southern-stars-win-first-t20-against-ireland-women-20150820-gj466x.html
Blank ,Live: St George Illawarra Dragons v Penrith Panthers ,All the action as it happens from WIN Stadium in Wollongong as St George Illawarra tackle the Penrith Panthers. ,Blank ,TheAge RSS News Headlines ,Thu 20 Aug 2015 11:39:03 -0000 ,http://theage.com.au/rugby-league/rugby-league-match-centre/live-st-george-illawarra-dragons-v-penrith-panthers-20150820-gj43n7.html
Blank ,Central Coast Mariners complete Canberra double with 3-1 win against Gungahlin United ,Irish recruit Roy O'Donovan bagged a brace in the first six minutes as the Central Coast Mariners beat Gungahlin United 3-1 on Thursday night. ,Blank ,TheAge RSS News Headlines ,Thu 20 Aug 2015 10:52:37 -0000 ,http://theage.com.au/sport/soccer/central-coast-mariners/central-coast-mariners-v-gungahlin-united-20150820-gj4382.html
Blank ,Woolworths petrol station lottery deal shocks ACT government angers newsagents ,Scratchies could be sold at Canberra petrol stations under a deal that has caught the ACT government flat-footed and left newsagents throughout the capital afraid for their future. ,Blank ,TheAge RSS News Headlines ,Thu 20 Aug 2015 10:52:16 -0000 ,http://theage.com.au/act-news/woolworths-petrol-station-lottery-deal-shocks-act-government-angers-newsagents-20150820-gj3y0t.html
Blank ,What's on in Sydney this weekend: 20 things to hear see and do ,From Shakespeare's The Tempest to comedy with Dave Hughes and Dylan Moran and music with Hiatus Kaiyote we have your weekend covered.  ,Blank ,TheAge RSS News Headlines ,Thu 20 Aug 2015 10:50:28 -0000 ,http://theage.com.au/entertainment/about-town/whats-on-in-sydney-this-weekend-20-things-to-hear-see-and-do-20150820-gj43pg.html
Blank ,Brent Zerafa the latest to be charged in ongoing Sam Kavanagh cobalt inquiries  ,Media personality Brent Zerafa is the latest person to be charged in relation to the on-going cobalt inquiry into the Sam Kavanagh stable on Thursday. ,Blank ,TheAge RSS News Headlines ,Thu 20 Aug 2015 10:48:08 -0000 ,http://theage.com.au/sport/horseracing/brent-zerafa-the-latest-to-be-charged-in-ongoing-sam-kavanagh-cobalt-inquiries-20150820-gj42j3.html
